label,sublabel,description,styles,bgcolor
燃えるごみ,,「週2回の燃えるごみの日」に出せるものです。町指定の赤い袋に入れて出してください。,img/moyasu02.svg,#ea3b13
プラスティック,,ペットボトルやトレー以外のプラスティック製品のゴミです。町指定の緑色の袋に入れて出してください。,img/shigen02.svg,#08b925
燃えないごみ,,町指定の透明の袋に入る不燃ゴミです。袋に入らないものは粗大ゴミとして出してください。,img/moyasanai02.svg,#733b96
飲料用びん,,町指定の透明の袋に入る飲料瓶ゴミです。袋に入らないものは粗大ゴミとして出してください。,img/bin02.svg,#2dc7aa
古着・新聞・雑誌,,下着（洗濯してきれいなもの）、スーツ、ジャンパー（革製品以外）、その他の衣類ゴミです。,img/shigen02.svg,#bbe400
トレー,,スーパーマーケットのお惣菜などで使われている白色のトレーです、白色以外はプラスティックゴミとして出してください。町指定の緑色の袋に入れて出してください。,img/shigen02.svg,#08b925
ペットボトル,,ペットボトルからラベルとキャップをはずした本体を、町指定の緑色の袋に入れて出してください。,img/shigen02.svg,#81d12e
紙パック,,あああああああ,img/shigen02.svg,#27a047
飲料缶,,飲料缶などを、町指定の青色の袋に入れて出してください。,img/shigen02.svg,#13c4e1
